<?xml version="1.0" encoding="UTF-8"?>
<map xmlns:xsi="http://www.w3.org/2001/XMLSchema-instance"
	xsi:noNamespaceSchemaLocation="map.xsd">
	<description>Curvy Easy</description>
	<images>
		<image>curvyEasy.jpg</image>
	</images>
	<pathPoints>
		<point x="0" y="298" />
		<point x="236" y="296" />
		<point x="267" y="295" />
		<point x="289" y="290" />
		<point x="304" y="284" />
		<point x="316" y="275" />
		<point x="323" y="263" />
		<point x="327" y="248" />
		<point x="327" y="229" />
		<point x="325" y="208" />
		<point x="317" y="190" />
		<point x="304" y="182" />
		<point x="289" y="179" />
		<point x="275" y="187" />
		<point x="268" y="204" />
		<point x="266" y="223" />
		<point x="267" y="247" />
		<point x="280" y="273" />
		<point x="306" y="301" />
		<point x="323" y="325" />
		<point x="328" y="340" />
		<point x="330" y="356" />
		<point x="326" y="375" />
		<point x="316" y="390" />
		<point x="305" y="394" />
		<point x="290" y="396" />
		<point x="278" y="392" />
		<point x="269" y="380" />
		<point x="263" y="358" />
		<point x="264" y="343" />
		<point x="269" y="328" />
		<point x="278" y="315" />
		<point x="300" y="303" />
		<point x="343" y="296" />
		<point x="599" y="292" />
	</pathPoints>
	<path>
		<polygon>
			<point x="0" y="264" />
			<point x="236" y="265" />
			<point x="231" y="236" />
			<point x="230" y="200" />
			<point x="240" y="174" />
			<point x="250" y="161" />
			<point x="260" y="153" />
			<point x="270" y="148" />
			<point x="280" y="145" />
			<point x="290" y="143" />
			<point x="300" y="144" />
			<point x="310" y="145" />
			<point x="320" y="149" />
			<point x="330" y="154" />
			<point x="340" y="162" />
			<point x="350" y="175" />
			<point x="360" y="200" />
			<point x="363" y="233" />
			<point x="362" y="261" />
			<point x="399" y="260" />
			<point x="599" y="259" />
			<point x="599" y="322" />
			<point x="369" y="327" />
			<point x="362" y="329" />
			<point x="364" y="358" />
			<point x="359" y="380" />
			<point x="349" y="401" />
			<point x="339" y="413" />
			<point x="329" y="420" />
			<point x="319" y="424" />
			<point x="309" y="426" />
			<point x="299" y="427" />
			<point x="289" y="426" />
			<point x="279" y="423" />
			<point x="269" y="419" />
			<point x="259" y="413" />
			<point x="249" y="403" />
			<point x="239" y="388" />
			<point x="231" y="358" />
			<point x="231" y="325" />
			<point x="179" y="326" />
			<point x="0" y="326" />
		</polygon>
	</path>
	<pathBounds>
		<polygon>
			<point x="0" y="264" />
			<point x="236" y="265" />
			<point x="230" y="200" />
			<point x="240" y="174" />
			<point x="270" y="148" />
			<point x="300" y="144" />
			<point x="330" y="154" />
			<point x="350" y="175" />
			<point x="360" y="200" />
			<point x="363" y="233" />
			<point x="362" y="261" />
			<point x="599" y="259" />
			<point x="599" y="322" />
			<point x="362" y="329" />
			<point x="359" y="380" />
			<point x="339" y="413" />
			<point x="319" y="424" />
			<point x="279" y="423" />
			<point x="259" y="413" />
			<point x="249" y="403" />
			<point x="239" y="388" />
			<point x="231" y="325" />
			<point x="0" y="326" />
		</polygon>
	</pathBounds>
</map>
